,Artist,Biography,Listeners,Playcount,Similar
414,Stafrænn Hákon,"The Icelandic band Stafrænn Hákon was born in 2001 as a lo-fi experimental project and has been steadily evolving ever since. Today its a full band which incidentally has released its 11th album titled Aftur. Aftur follows 2017's self-released instrumental album Hausi and two Darla released full length albums Eternal Horse and Sanitas.

After Stafrænn Hákon released its instrumental album Hausi in 2017, the band decided to delve into the melodic aspect of music, focusing on harmonized vocals and subtle, yet dynamic instrumentation. <a href=""https://www.last.fm/music/+noredirect/Stafr%C3%A6nn+H%C3%A1kon"">Read more on Last.fm</a>",125007,1087205,"('Pornopop', '500won Project', 'Parachutes', 'Kira Kira', 'Hilmar Örn Hilmarsson & Sigur Rós')"
415,Trumans Water,"Trumans Water is an indie rock band that formed in 1991 in San Diego, California. Their current lineup consists of Kirk and Kevin Branstetter (guitars/vocals/etc), Mike Coumatos (bass/vocals), and John Schier (drums). Throughout their career, they have combined avant-garde influences from music such as Sun City Girls, Captain Beefheart, and free jazz with a Sonic Youth/Boredoms-esque indie/punk/noise rock sensibility to create consistently unusual and uncompromising music that is just as composed as it is chaotic-sounding. <a href=""https://www.last.fm/music/Trumans+Water"">Read more on Last.fm</a>",10029,214754,"('Colossamite', 'Lake of Dracula', 'Uzeda', 'Pitchblende', 'The Grifters')"
416,Glen Campbell,"Glen Travis Campbell (April 22, 1936 – August 8, 2017) was an American rock and country music singer, musician, songwriter, television host and actor. He is known for a series of hits in the 1960s and 1970s, and for hosting a music and comedy variety show called The Glen Campbell Goodtime Hour on CBS television from January 1969 through June 1972.

During his 50 years in show business, Campbell released more than 70 albums. He sold 45 million records and accumulated 12 RIAA Gold albums, four Platinum albums and one Double-platinum album. <a href=""https://www.last.fm/music/Glen+Campbell"">Read more on Last.fm</a>",1027458,11580031,"('Lynn Anderson', 'Charlie Rich', 'Ray Price', 'Sonny James', 'Conway Twitty')"
417,Pat Kelly,"Pat Kelly (1949 – 16 July 2019) was a Jamaican rocksteady and reggae singer. He became the lead singer of The Techniques in the late 1960's and then left for a solo career. He was also a sound engineer for King Tubby's Studio or Channel One Recording Studio in the 1970s.

Kelly was born in Kingston in 1949. After leaving school, he spent a year studying electronics in Springfield, Massachusetts, United States during 1966, before returning to Jamaica. <a href=""https://www.last.fm/music/Pat+Kelly"">Read more on Last.fm</a>",73233,410780,"('Clancy Eccles', 'Derrick Morgan', 'The Kingstonians', 'The Gaylads', 'The Tennors')"
418,Raimon,"Ramon Pelegero Sanchis (Raimon), born in Xàtiva in 1940, is an important and well-known singer and songwriter from València (Spain). Many know his work for its implication in the political and social movements against the Francisco Franco's fascist dictatorship (1936-1975). Raimon is also known for his vinculation to the ideas of self-determination for València and the Països Catalans (Catalan Countries) and he and his songs have became a symbol of the national fight of this country. <a href=""https://www.last.fm/music/Raimon"">Read more on Last.fm</a>",8253,73510,"('Ovidi Montllor', 'Al Tall', 'Maria Del Mar Bonet', 'Sisa', 'Pau Riba')"
419,Roberto Goyeneche,"Roberto Goyeneche (1926 - 1994) was an Argentine tango singer who epitomized the archetype of 1950s Buenos Aires' bohemian life, and became a living legend in the local music scene.

It was in 1944, at the age of 18, when the talented troubadour joined Raúl Kaplún's orchestra after winning a local contest, soon, debuting live in a local radio station called Belgrano. In 1952, Goyeneche teamed up with Horacio Salgán and with Aníbal Troilo in 1956 <a href=""https://www.last.fm/music/Roberto+Goyeneche"">Read more on Last.fm</a>",58795,562439,"('Julio Sosa', 'Carlos Gardel', 'Cacho Castaña', 'Astor Piazzolla', 'Osvaldo Pugliese')"
420,Insanity Wave,"Things got started at the dusk of the vynil era!! The music world has changed greatly since then but in the meantime Insanity Wave has been able to consolidate a very personal style remaining true to their spirit. Let´s get to the facts. In 1992 the band recorded their first demo. This allowed them to sign with “La Fábrica magnetica”, a prestigious spanish indepent label that released their first E.p. “Insanity Wave” in 1993 and the ""Go Off"" album in 1995. <a href=""https://www.last.fm/music/Insanity+Wave"">Read more on Last.fm</a>",1255,4327,"('Pribata Idaho', 'Australian Blonde', 'Cecilia Ann', 'Chucho', 'The Pribata Idaho')"
421,Los Llopis," <a href=""https://www.last.fm/music/Los+Llopis"">Read more on Last.fm</a>",3909,15331,"('Los Sinners', 'Los Crazy Boys', 'Los Juniors', 'Los Loud Jets', 'Los Belmonts')"
422,Dorsey Burnette,"Dorsey Burnette (December 28, 1932 - August 19, 1979) was an early Rockabilly singer from Memphis, Tennessee and with his younger brother Johnny Burnette and a friend named Paul Burlison was one of the founder members of The Rock and Roll Trio.

The ‘e’ at the end of the name was added later. His younger brother John Joseph (Johnny) was born nearly fifteen months later on March 25, 1934. The Burnette Brothers grew up in a public housing project in the Lauderdale Courts area of Memphis <a href=""https://www.last.fm/music/Dorsey+Burnette"">Read more on Last.fm</a>",10792,47274,"('Johnny Carroll', 'Ray Campi', 'Eddie Fontaine', 'Roy Hall', 'Jackie Lee Cochran')"
423,The Groove Hogs,"The Groove Hogs are a 9-piece blues band, prominently featuring a well-regarded horn section. Formed in Fond Du Lac, Wisconsin in 1994, the 'Hogs have expanded their repertoire to include soul and original compositions, usually with a strong blues inflection.

The Groove Hogs line up includes (or has included): 
Steve Cooper, Tenor Sax, Vocals
Greg Garcia, Trumpet
Brian Gruselle, Keyboards, Vocals
Ron Hanson, Vocals
Drew Hicks, Bass, Vocals
Pat Kiel, Guitar, Vocals <a href=""https://www.last.fm/music/The+Groove+Hogs"">Read more on Last.fm</a>",787,5693,"('John Earl Walker Band', 'John Earl Walker', 'Scott Ellison', 'Erick Hovey', 'Eddy ""The Chief"" Clearwater')"
424,Jamrud,"Jamrud is a rock band from Indonesia was first formed in 1989 in Cimahi, West Java, Indonesia with the name of Jamrock.
Conceptor Jamrud  are 'Aziz' Mangasi Siagian (guitar) and 'Ricky' Teddy (bass) and is known as a successful music group carrying the rock as a popular music in Indonesia in the 90's.

Before become to Jamrud, the early formation of Jamrock:
 'Aziz' Mangasi Siagian (guitar), 'Ricky' Teddy (bass), Agus (drums) and Oppi (vocals). 
This group is several times through personnel changes <a href=""https://www.last.fm/music/Jamrud"">Read more on Last.fm</a>",16928,308835,"('Andra And The Backbone', 'Tipe-X', 'Slank', 'Padi', 'Kotak')"
425,Isis,"There are at least eight artists that have used the name Isis:

1. Isis was a Los Angeles, CA based band that started in Boston, MA in 1997. They borrowed from and helped to evolve a sound pioneered by the likes of Neurosis and Godflesh, creating heavy music consisting primarily of lengthy songs that focus on repetition and evolution of structure and texture. As such, their music encompasses a considerable range of genres. Some of these include sludge metal <a href=""https://www.last.fm/music/Isis"">Read more on Last.fm</a>",504141,25570311,"('Cult of Luna', 'Neurosis', 'Rosetta', 'Isis + Aereogramme', 'Pelican')"
426,Vodka Juniors,"Vodka Juniors (usually refered to as: Vodkes, the Juniors or VJ) is a hardcore punk band formed in Athens back in 2000. Band consists of: Dirty Harry (vocals / guitar), Kostis Jr. (guitar / vocals), Fudukis (bass) and Ramirez (drums).

Their first release was a demo cassette in 2000 called ""No Drinks for You"". Since then, their next releases that were followed were under the recording label of Cannonball 666 Records.

Their music style is a mixture of hardcore punk of 80's, melodic elements, happy / joyful choruses and fast galloping drums. <a href=""https://www.last.fm/music/Vodka+Juniors"">Read more on Last.fm</a>",5686,229013,"('Χάσμα', 'Despite Everything', 'Bad Movies', 'Χατ Τρικ', 'Μεθυσμένα Ξωτικά')"
427,Joe Bennett,"Joe Bennett and the Sparkletones 
was a teenage rock 'n roll group 
from Spartanburg, SC, 
consisting of Joe Bennett (lead 
vocals lead guitar), Howard 
Childress (vocal, guitar), Wayne 
Arthur (vocal, bass), and Jimmy 
Denton (drums), that charted 
Billboard with  a number 17 pop 
hit in 1957 with ""Black Slacks.""

Joe Bennett and The Sparkletones 
were a remarkable group of 
teenagers who wrote and 
played almost all their own 
material in the late '50s. They  <a href=""https://www.last.fm/music/Joe+Bennett"">Read more on Last.fm</a>",1198,5527,"('Pirate Dreams', ""Hanna's Reef"", 'The Coconut Boat Band', 'Bob Karwin', 'Gene Mitchell')"
428,The Dudley Corporation,"The Dudley Corporation is a three-piece indie rock band from Dublin, Ireland, comprised of Dudley Colley, Joss Moorkens and Mark Jordan.

They first played live in January 2000 and released the first of 7 singles (including splits with Boris, Paul O'Reilly and Querelle) later that year. Their 1st LP, The Lonely World of The Dudley Corporation, preceded their first tours to the US and UK, In Love With The Dudley Corporation brought further visits to the US <a href=""https://www.last.fm/music/The+Dudley+Corporation"">Read more on Last.fm</a>",5869,44223,"('The Playwrights', 'Large Mound', 'Turn', 'Bottom of the Hudson', 'The Walls')"
429,Wolf Eyes,"Wolf Eyes began as a solo project of former Nautical Almanac member  Nate Young in Ann Arbor, Michigan, United States in 1996, with Aaron Dilloway joining in 1999, and John Olson in 2000. During this time, the band also briefly relocated to New York City and at one point enlisted Andrew Wilkes-Krier, now known to the public as Andrew W.K.. The group is rumored to have released over 150 recordings in their relatively short lifespan, on labels such as Bulb Records <a href=""https://www.last.fm/music/Wolf+Eyes"">Read more on Last.fm</a>",78099,965821,"('Aaron Dilloway', 'Merzbow', 'Prurient', 'Pedestrian Deposit', 'Shit and Shine')"
430,Jorge Calleja," <a href=""https://www.last.fm/music/Jorge+Calleja"">Read more on Last.fm</a>",81,466,"('Cabezas de Cera', 'Silvestre Revueltas', 'José Pablo Moncayo', 'Manuel Ponce', 'Parazit')"
431,Charlie Monttana," <a href=""https://www.last.fm/music/Charlie+Monttana"">Read more on Last.fm</a>",7315,91767,"('Corcobado', 'Banda Bostik', 'Heavy Nopal', 'Sam Sam', 'Blues Boys')"
432,The Consortium Of Genius," <a href=""https://www.last.fm/music/The+Consortium+Of+Genius"">Read more on Last.fm</a>",269,6309,"('Steve Goodie', 'Consortium of Genius', 'Milo Murphy', 'Worm Quartet', 'Devo Spice')"
433,Claudio Rocchi,"Claudio Rocchi was the original bass guitarist of Stormy Six, and played on their first album Le idee di oggi per la musica di domani, leaving the band soon after the album release for a solo career that started in 1970 with the first album, Viaggio, mainly acoustic and with good flute playing by PFM's Mauro Pagani.

Always influenced by eastern doctrines (he later became a Hare Krishna), he was also active in anti-war movements and always present at the various Italian pop festivals of the early 70's. <a href=""https://www.last.fm/music/Claudio+Rocchi"">Read more on Last.fm</a>",3973,40305,"('Festa Mobile', ""Rocky's Filj"", 'Perigeo', 'De De Lind', 'Reale Accademia Di Musica')"
434,The Queers,"The Queers are a pop-punk/punk rock band from Portsmouth, New Hampshire, formed in 1982. Singer/Guitarist/Songwriter Joe King has been the principal member of the group, with a vast number of musicians cycling in and out of the band over the years. Supposedly, the band name 'Queers' was used simply to poke fun at what he called the ""Art Fag"" community in NH. That same brand of humor and inanity has become a staple of The Queers music, who have produced songs such as ""Can't Stop Farting"" <a href=""https://www.last.fm/music/The+Queers"">Read more on Last.fm</a>",171585,3843134,"('Riverdales', 'Screeching Weasel', 'The Mr. T Experience', 'Teen Idols', 'The Methadones')"
435,Juice Newton,"Juice Newton was born Judith Kaye Newton on 18 February 1952 in Lakehurst, New Jersey and grew up in Virginia Beach, Virginia. She is an American pop music and country singer. She managed to mix folk, rock, blues and pop into a hugely successful career in country music. To date she has sold over 10 million albums, managed 19 hit singles across the US country, pop and adult contemporary charts. She has also won 2 Billboard Awards, 1 Grammy and the CMA Award for Best New Female Artist. <a href=""https://www.last.fm/music/Juice+Newton"">Read more on Last.fm</a>",283353,1991062,"('Eddie Rabbitt', 'Crystal Gayle', 'Ronnie Milsap', 'The Oak Ridge Boys', 'Mickey Gilley')"
436,Los Chicles,"Los Chicles was a pop band from San Miguel de Tucumán. 

The group was composed, for most of their history, by Patricio Garcia (guitars and voice, the main composer of the group), Gerardo Cuneo (bass) and Matias Lazzo (lead guitar). 

Their first drummer was Juan Carlos Thouvier, who left around 1999 and they decided to replace the drum sounds with pre programmed beats and samples courtesy of Martin Villa, who became an important part of their sound. <a href=""https://www.last.fm/music/Los+Chicles"">Read more on Last.fm</a>",291,14276,"('Estación Experimental', 'Monoambiente', 'Patricio García', 'La Hermana Menor', 'Compañero Asma')"
437,Music for Aardvarks and Other Mammals," <a href=""https://www.last.fm/music/Music+for+Aardvarks+and+Other+Mammals"">Read more on Last.fm</a>",492,9474,"('David Weinstone Presents Music for Aardvarks and Other Mammals', 'David Weinstone', 'Music For Aardvarks and Other Mammals/David Weinstone', 'Dan Zanes', 'Dan Zanes and Friends')"
438,Lito Vitale,"Talentoso pianista, fue inicialmente alumno de su madre, la profesora Esther Soto. Junto con otros colegas músicos vecinos del partido de San Isidro en el Gran Buenos Aires, formaron la Cooperativa de Música «MIA» (iniciales de «Músicos Independientes Asociados») cuando contaba sólo 13 años. «MIA» se hizo popular en los ambientes de rock progresivo a fines de los años 1970.
 Otros músicos arrancaron a través de MIA, incluyendo a su hermana Liliana <a href=""https://www.last.fm/music/Lito+Vitale"">Read more on Last.fm</a>",21668,149191,"('Spinetta, García, Ferrón', 'Lito Vitale Cuarteto', 'David Lebón', 'Ella es Tan Cargosa', 'Nito Mestre')"
439,Will Handsome," <a href=""https://www.last.fm/music/Will+Handsome"">Read more on Last.fm</a>",95,404,"('Nev Nicholls',)"
440,B.B. King,"B. B. King (b. September 16, 1925 in Itta Bena, Mississippi; died May 14, 2015 in Las Vegas) was a U.S. blues guitarist and songwriter. He is among the most respected electric guitarists; Rolling Stone magazine ranked him third in its list of the hundred greatest guitarists of all time.

Born as Riley B. King, he began broadcasting his music live on a Memphis radio station called WDIA. At first, he used the name The Peptikon Boy on air, which later was changed to The Beale Street Blues Boy, and then further shortened to just Blues Boy or B.B. <a href=""https://www.last.fm/music/B.B.+King"">Read more on Last.fm</a>",1253441,19676658,"('Albert King', 'Freddie King', 'Buddy Guy', 'Muddy Waters', 'John Lee Hooker')"
441,Division of Laura Lee,"Division Of Laura Lee is a band of Swedish musicians originally from Vänersborg, Sweden heavily influenced by post-punk bands, britpop and the DC music scene (Dischord Records). The names comes from Laura Lee, a soul singer and the phrase ""Division Of"" which was spotted on a cardboard box at their practice space. The band resides in Gothenburg, Sweden.

Two of the founding members also play in Frantic Mantis.

Artist home page
Wikipedia
MySpace page <a href=""https://www.last.fm/music/Division+of+Laura+Lee"">Read more on Last.fm</a>",44579,580179,"('Deviates', 'The (International) Noise Conspiracy', 'The Soundtrack of Our Lives', 'bob hund', 'Weeping Willows')"
442,Felipe Conde," <a href=""https://www.last.fm/music/Felipe+Conde"">Read more on Last.fm</a>",671,3871,"('Los Rebujitos', 'Sergio Contreras', 'Decai', 'Kiko & Shara', 'El Tren De Los Sueños')"
443,Goran Karan,"
 


Goran Karan was born on April 2, 1964. In the beginning of the 80's, Goran started his career as a musician in various bands such as ""Epicentar"", ""Deveti krug"", ""Zippo"" and ""Big Blue"".

In 1995, as a frontman of the band called ""Big Blue"", Goran received an award for the rock hit of the year for the song ""Priznaj mi"". Later in the same year, Goran was given the lead role in the musical ""Sarajevski krug"" (The Sarajevo circle). Album from the musical   and the Big Blue's debut album were released both in Croatian and English. <a href=""https://www.last.fm/music/Goran+Karan"">Read more on Last.fm</a>",13285,127274,"('Giuliano', 'Petar Grašo', 'Danijela', 'Ivana Banfić', 'Jasna Zlokic')"
444,Muzzarelas,"Punk Rock Bizarro-core de Campinas, interior de SP.
Com letras sobre cerveja, et's, cotidiano e MUITO humor essa banda se destaca no cenário por ter um estilo único <a href=""https://www.last.fm/music/Muzzarelas"">Read more on Last.fm</a>",1564,46926,"('Drákula', 'Skate Aranha', 'Holly Tree', 'Carbona', 'DFC')"
445,Imperio Argentina,"Magdalena Nile del Río (December 26, 1906 – August 22, 2003) was a professional singer and movie actress who was better known as Imperio Argentina. Though she was born in Buenos Aires, Argentina, she became a citizen of Spain.

Del Río performed in Argentina's theaters, where she had a long and successful career. At that time, her stage name was Pettit Imperio. But her most successful moments came after she moved to Spain. It was there that she changed her name to Imperio Argentina, as a way to honor her ""other country"". <a href=""https://www.last.fm/music/Imperio+Argentina"">Read more on Last.fm</a>",4014,23035,"('Juanita Reina', 'Estrellita Castro', 'Marifé De Triana', 'Concha Piquer', 'Pepe Blanco')"
446,Dept,"Dept (เดป) is a male duo under Smallroom. They debuted on June 15, 2018 with the digital single ""ForWhat?"". <a href=""https://www.last.fm/music/+noredirect/Dept"">Read more on Last.fm</a>",152379,3543149,()
447,Leslie Smith,"Leslie Smith's voice evokes the mountain essence of bitter winds and rolling, rugged terrain, but her writing unfolds into an urban sensibility. Her songs reveal an unusual yet grounded comprehension of the lives we lead, and through them she leads us to ourselves. Leslie Smith has the rare ability to captivate us, to move us, and then render us repeatedly amazed at the depth of feeling that resonates within. <a href=""https://www.last.fm/music/Leslie+Smith"">Read more on Last.fm</a>",879,7521,"('Robert Byrne', 'Larry Lee', 'Randy Goodrum', 'David Roberts', 'Tony Sciuto')"
448,Ainhoa,"Ainhoa Cantalapiedra (born 25 September 1980 in Galdakao, Spain) is a popular Spanish singer/songwriter, most commonly known as Ainhoa. She is the winner of the second series of Operacion Triunfo (Spanish version of Fame Academy).

In 2003, Ainhoa released her highly anticipated debut album, ‘Escencia Natural’ (Natural Essence). It was produced by Latin grammy award winning record executive, Emilio Estefan, and was very successful in Spain, eventually selling over 300,000 copies. <a href=""https://www.last.fm/music/Ainhoa"">Read more on Last.fm</a>",3718,38208,"('Andermay', 'Soraya Arnelas', 'Roser', 'Belén Arjona', 'Rosa López')"
449,Icecream Hands,"The Australian power-pop band Ice Cream Hands comprised singer/guitarist Charles Jenkins, guitarist Marcus Goodwin, bassist Douglas Lee Robertson and drummer Derek Smiley. Debuting in late 1992 with a self-titled EP, the group issued their first full-length release Travelling...Made Easy a year later. After 1994's Supermarket Scene EP, Ice Cream Hands issued another stop-gap single release, Olive, before finally resurfacing with their sophomore LP Memory Lane Traffic Jam in 1997. <a href=""https://www.last.fm/music/Icecream+Hands"">Read more on Last.fm</a>",3267,68887,"('Tim Rogers & The Twin Set', ""Rebecca's Empire"", 'Machine Translations', 'Michael Carpenter', 'The Orange Humble Band')"
450,Kick the Kangaroo,"Kick the Kangaroo is a Danish rock band consisting of Michael Lund (Lead vocals, additional guitar), Søren Andersen (Guitar, backing vocals), Lars Andresen (Keyboards, backing vocals), Flemming Koch (Drums, backing vocals) and Martin Hald (Bass, backing vocals). On the bands website they state that ""Kick The Kangaroo's music is based mainly on Australian and American guitar-rock/pop"". They have named their own brand of musical style ""active rock"".  <a href=""https://www.last.fm/music/Kick+the+Kangaroo"">Read more on Last.fm</a>",234,4660,"('inside the whale', 'Sko/Torp', 'Backseat', ""Everybody's Talking"", 'Zididada')"
451,Piet Botha,"Piet Botha (18 July 1955 – 2 June 2019)[1] was a South African musician and the frontman of the South African rock band Jack Hammer (in which he was known as ""The Hammer""), which has been an opening act for bands such as ZZ Top, Deep Purple and Uriah Heep. He also performed solo.

Piet Botha was born in 1955 and shared his birth date of 18th July with Nelson Mandela. He began writing songs and forming bands while still at school and his first professional gig was as an acoustic duo in 1974 at a local drinking hole in Pretoria. <a href=""https://www.last.fm/music/Piet+Botha"">Read more on Last.fm</a>",733,15177,"('Valiant Swart', 'Koos Kombuis', 'Anton Goosen', 'Jan Blohm', 'Akkedis')"
452,Asa Brebner,"Asa Brebner (November 21, 1953 - March 10, 2019) was an American guitarist, singer and songwriter. He was a member of The Modern Lovers, Robin Lane & The Chartbusters, Spitballs and Mickey Clean and the Mezz.

Asa Brebner grew up in Boston, the only child of two writers. He attended a progressive high school and learned guitar from listening to R&B, the Rolling Stones and odd-ball blues records. After graduation he and a friend hitchhiked through Central and South America. <a href=""https://www.last.fm/music/Asa+Brebner"">Read more on Last.fm</a>",220,1069,"('Questions of the North', 'Harboring Ghosts', 'Smoke And Smoke', 'Aeneas', 'A World In Grayscale')"
453,Figaga," <a href=""https://www.last.fm/music/Figaga"">Read more on Last.fm</a>",24,45,"('Garifuna Kids', 'Kazzabe')"
454,Dan Toren,"Members recording and performing since 1987ex band member with Shunra ,Balagan , THe Flys. 8 solo albums, The new album-A talk wit Mick is free to download at http://www.dantoren.com/cds/mik/index.htm  
Influences shows dateds are updeted allways here: http://www.dantoren.com/show/date/date.asp 
 <a href=""https://www.last.fm/music/Dan+Toren"">Read more on Last.fm</a>",1942,16773,"('Micha Shitrit', 'The Friends of Natasha', 'Yermi Kaplan', 'Maor Cohen', 'Fortisakharof')"
455,Juliet Jonesin Sydän,"Juliet Jonesin Sydän (Juliet Jones' Heart) is a Finnish rock band which was founded in 1980. During the years 1985-2001 they have recorded overall ten albums and  five collections.

The most popular songs of JJS are ""Helppo elämä"" (Easy life) and ""Miksi naiset aina rakastuvat renttuihin?"" (Why the women always fall in love with losers?). <a href=""https://www.last.fm/music/+noredirect/Juliet+Jonesin+Syd%C3%A4n"">Read more on Last.fm</a>",15174,234030,"('Pelle Miljoona Oy', 'Aknestik', 'Ne Luumäet', 'Sleepy Sleepers', 'Freud Marx Engels & Jung')"
456,Art Zoyd,"Art Zoyd is a French band formed in 1969, mixing free jazz, progressive rock and avant-garde electronica.

Like other members of the Rock in Opposition movement, Art Zoyd fuses progressive rock and jazz with contemporary classical music. Like fellow RIO member Univers Zero, they are also influenced by French Zeuhl bands such as Magma. Today, Art Zoyd is best described as an electronic music group and works primarily for film and ballet. Gérard Hourbette <a href=""https://www.last.fm/music/Art+Zoyd"">Read more on Last.fm</a>",22337,490523,"('Univers Zero', 'Henry Cow', 'Samla Mammas Manna', 'Art Bears', 'Fred Frith')"
457,Mark Wynter,"Mark Wynter was a brittish pop-singer, popular in the early 1960's. In 1962 he recorded a version of the song ""Venus in Blue Jeans"" which hit #4 on UK charts. <a href=""https://www.last.fm/music/Mark+Wynter"">Read more on Last.fm</a>",12969,63498,"('Eden Kane', 'Craig Douglas', 'Kenny Lynch', 'Joe Brown & The Bruvvers', 'Kathy Kirby')"
458,The Ugly Ducklings,"The Ugly Ducklings were a 5-piece garage rock group based in Toronto, Ontario Canada during the mid-sixties.
The group was formed in 1965 with Dave Bingham (lead vocals, harmonica), Glynn Bell (rhythm guitar), Rodger Mayne (lead guitar), John Read (bass), and Robin Boers (drums). In their early beginnings their music was partially influenced by The Who and The Yardbirds, however the band was still able to create a rough individual sound typified by their solid garage-punk material and raw delivery. <a href=""https://www.last.fm/music/The+Ugly+Ducklings"">Read more on Last.fm</a>",14392,67052,"('The Del-Vetts', 'The Gants', 'The Gestures', 'The Weeds', 'The Alarm Clocks')"
