,Artist,Biography,Listeners,Playcount,Similar
143,Los Freddy's,"Los Freddy's (or Los Freddys) were a Mexican musical group, founded in 1962 in Guadalajara, Jalisco.

The group was one of the most popular Mexican ensembles of the 1960s and 1970s. Early in their careers, the group earned popularity by playing cover songs of popular English-language songs (such as Sam the Sham & the Pharaohs' ""Wooly Bully"" and The Beatles' ""Penny Lane"") that were translated into Spanish, as well as producing original romantic ballads. <a href=""https://www.last.fm/music/Los+Freddy%27s"">Read more on Last.fm</a>",17474,134311,"('Los Muecas', 'Industria Del Amor', 'Lorenzo de Monteclaro', 'La Autoridad De La Sierra', 'Beatriz Adriana')"
144,Termites,"

 <a href=""https://www.last.fm/music/+noredirect/Termites"">Read more on Last.fm</a>",1049,5174,()
145,chewbacca's,"By www.soundsxp.com: ""Chewbaccas were a lot more Empire Strikes Back. It would be easy to dismiss this cool and cartoonish band as ""Hombre o Astrohombre"" but if anything they have a broader spectrum both sonically and musically than their heroes. Surf, samplers and SFX collide with Detroit rock and funky wah bass to provide the perfect soundtrack for a hover car chase. Loud, fast and""quirky: the MC5 meet the Munsters at Mission Control."" Earth people, are you ready for the INVASION? <a href=""https://www.last.fm/music/chewbacca%27s"">Read more on Last.fm</a>",3783,18313,"('The Star And Key Of The Indian Ocean', 'Alwaro Negro', 'Jackie and The Cedrics', ""Estrume'n'tal"", 'The Retroliners')"
146,7 Foot Jr.,"7FOOT JR. was formed back in December 1999 by brothers Allan and Mike Elgar, Macky Macaventa and Frank de Castro.

From the onset, the band went on to write and perform their original material. By March 2000, the single entitled MATA (written and sung by Mike Elgar) was aired over Manila's rock radio stations. Soon after, MAHIWAGANG OO (written and sung by Macky Macaventa) was also released as a follow-up.

By June 2001, Mike was invited to join Rivermaya, so the band moved on with Leo Amistoso to take on the vocal duty and front the band. <a href=""https://www.last.fm/music/7+Foot+Jr."">Read more on Last.fm</a>",1032,9611,"('Bleud', 'Banig', 'Florante Aguilar & Lori Abucayan', 'Various Artists - Star Records', 'Kate D.')"
147,Need New Body,"Formed from the remnants of Bent Leg Fatima, Need New Body have been called everything from ""beardo wierdcore"" to ""spazzcore,"" due to its splicing of such disparate styles as noise rock, folk, avant-garde and jazz. Percussionist Chris Powell, keyboardists Dale Jimenez and Jamey Robinson and vocalist/multi-instrumentalist Jeff Bradbury formed Bent Leg Fatima in 1996 and later moved to Philadelphia in 1999 before releasing their debut record. Shortly after, Robinson departed, resulting in the band's disintegration. <a href=""https://www.last.fm/music/Need+New+Body"">Read more on Last.fm</a>",18667,219247,"('Icy Demons', 'The USA Is a Monster', 'Pit Er Pat', 'Mahjongg', 'Wizardzz')"
148,I Lobello," <a href=""https://www.last.fm/music/+noredirect/I+Lobello"">Read more on Last.fm</a>",15,230,()
149,Let Me Introduce You to the End,"Inter-continental musical project, Let Me Introduce You To The End, has garnered worldwide attention for giving the most emotional performances in Poland. With their unique story and highly sentimental songs, LMIYTTE is fast becoming known for attracting teary-eyed fans to some of the most prestigious museums, theaters and venues in Europe and America.

LMIYTTE is an ensemble of musical artists all devoted to advancing the artistic endeavors of leader, Ryan Socash. <a href=""https://www.last.fm/music/Let+Me+Introduce+You+to+the+End"">Read more on Last.fm</a>",4275,120622,"('Iluzjon', 'Retrospective', 'George Dorn Screams', 'Satellite', 'FJIERI')"
150,Leroy Smart,"Leroy Smart, born 1952, Kingston, Jamaica, is a reggae singer and producer.

>>>Biography<<<

Smart was born in 1952 and orphaned aged 2. He was raised at Maxfield Park Childrens Home and educated at Alpha Boys School,[1] where he studied singing, drums and dancing.[2]

Smart recorded his first single, ""It Pains Me"" in 1969 for a producer called Mr. Caribbean.[3] In 1970 he recorded ""Ethiopia"" for Joe Gibbs, and the first version of one of his most famous songs, ""Pride & Ambition"", with producer Gussie Clarke. <a href=""https://www.last.fm/music/Leroy+Smart"">Read more on Last.fm</a>",53739,282832,"('Johnny Clarke', 'Barry Brown', 'Cornell Campbell', 'Frankie Paul', 'Delroy Wilson')"
151,Marc Sway," <a href=""https://www.last.fm/music/Marc+Sway"">Read more on Last.fm</a>",6538,58420,"('Adrian Stern', 'Caroline Chevin', 'Ritschi', 'Plüsch', 'Fabienne Louves')"
152,Malalma,"Cuando uno sueña con armar un grupo, una de las categorías más difíciles de mantener, es saber que en cualquier momento la tribu se acaba: desde los mayas hasta los muiscas.

Después de que se disuelve la “tribu musical” Cabuya, Sergio Arias y Edgar Jiménez con la experiencia de los últimos años de premios y fracasos, empezaron a trabajar sobre el concepto de crear un grupo de canciones que se combinaran con artes múltiples donde lo que prima es el sonido, la imagen y la sensación, independientemente de quiénes las toquen. <a href=""https://www.last.fm/music/Malalma"">Read more on Last.fm</a>",4501,36318,"('Velandia y la tigra', 'Pernett & The Caribbean Ravers', 'Palenke Soultribe', 'Hotel Mama', '1280 Almas')"
153,Dave Lindholm,"Ralf-Henrik ”Dave” Lindholm (born 31 March 1952, Helsinki) is Finnish guitarist and singer-songwriter who has made a career under his own name and also participated in some noteworthy groups. He has written songs and recorded in both Finnish and English.

Lindholm's first recordings were made with his band Ferris that published its sole recording in 1971 through Love Records label. He wanted to record for Love Records also under his own name. <a href=""https://www.last.fm/music/Dave+Lindholm"">Read more on Last.fm</a>",26617,423719,"('Isokynä Lindholm', 'Isokynä Lindholm & Orfeus', 'Bluesounds', 'Kauko Röyhkä', 'Kauko Röyhkä & Riku Mattila')"
154,The Golden Seals,"The Golden Seals are a Canadian indie rock band. Based in Ottawa, the band is led by singer and songwriter Dave Merritt. Other members include Philip Shaw Bova, Matt Ouimet, Steve Boudreau and Mike Bonnell.

The band was formed in 1999, after Merritt and Bonnell's prior bands, Adam West and The Buffalo Brothers, broke up. The two originally collaborated on a song for the Rheostatics album The Story of Harmelodia, ""Song of the Garden"", and then began working on the first Golden Seals album, Storybook Endings. <a href=""https://www.last.fm/music/The+Golden+Seals"">Read more on Last.fm</a>",1375,6193,"('Rheostatics', 'The Violet Archers', 'Nick Zubeck', 'Wooden Stars', 'Jim Bryson')"
155,Jesus Jones,"Jesus Jones are an English alternative rock group that has recorded and performed from the late 80s up into the present day, best known for their mainstream dance breakout hits in the early 90s such as ""Right Here Right Now"" and ""Real Real Real"" (both Top 40 tracks in both the U.S. and the U.K). Incorporating elements of electronic music styles such as house and techno to an alternative rock format, along with fellow British groups such as The Shamen <a href=""https://www.last.fm/music/Jesus+Jones"">Read more on Last.fm</a>",199022,1424321,"('Pop Will Eat Itself', 'EMF', ""Ned's Atomic Dustbin"", 'The Wonder Stuff', 'Carter the Unstoppable Sex Machine')"
156,Beatnik Turtle,"Beatnik Turtle is a remarkably prolific and fiercely independent band based in Chicago, IL. They have released over 450 songs, 365 of which were released in a single year--one for each day--at thesongoftheday.com where they continue to release a song every week.
 <a href=""https://www.last.fm/music/Beatnik+Turtle"">Read more on Last.fm</a>",1433,12767,"('The Great Luke Ski', ""TV's Kyle"", 'Ookla the Mok', 'Uncle Monsterface', 'Nuclear Bubble Wrap')"
157,Roy Orbison,"Roy Kelton Orbison (April 23, 1936 – December 6, 1988), nicknamed ""The Big O"", was an influential American singer-songwriter and a pioneer of rock and roll, whose recording career spanned more than four decades. By the mid-1960s Orbison was internationally recognized for his ballads of lost love, rhythmically advanced melodies, three-octave vocal range, characteristic dark sunglasses, and sometimes distinctive usage of falsetto, typified in songs such as ""Only the Lonely, ""Oh, Pretty Woman"", and ""Crying"". <a href=""https://www.last.fm/music/Roy+Orbison"">Read more on Last.fm</a>",1795194,21931813,"('The Everly Brothers', 'Traveling Wilburys', 'Jerry Lee Lewis', 'Elvis Presley', 'Buddy Holly')"
158,Seven Steps to the Green Door,"Lars Köhler (voc) 

Ronny Gruber (voc) 

Anne Trautmann (voc) 

Marek Arnold (keys, sax) 

Eddie Gemeinhardt (guit) 

Heiko Rehm (bass) 

Ulf Reinhardt (drums)

If a band with its debut album already creams off the first prize in two categories (progressive and experimental) at the German Rock and Pop Awards, the probably biggest and most important band competition in Germany, it definitely is worth it to listen carefully: with the moderate use of cross-genre stylistic devices <a href=""https://www.last.fm/music/Seven+Steps+to+the+Green+Door"">Read more on Last.fm</a>",2486,62141,"('Drifting Sun', '3rdegree', 'Leap Day', 'Eye 2 Eye', 'Jack Foster III')"
159,Midnight Configuration,"Trev formed Midnight Configuration originally as a solo project back in mid 1993 with the purchase of his first sequencer. Shortly afterwards he put out his first solo CD maxi called Gothtec, a four track affair where Trevor did absolutely everything! Once the wheels were in motion Trevor started work on the second maxi Spectral Dance which was released on the 31st of October 1994 at the very first Carnival Of Souls, the famous Gothic/fetish festival then held at Rock City in Nottingham. This night also saw the debut performance of the band.  <a href=""https://www.last.fm/music/Midnight+Configuration"">Read more on Last.fm</a>",9475,78891,"('Faithful Dawn', 'Every New Dead Ghost', 'Nekromantik', 'Phantom Vision', 'Athamay')"
160,Hateful Monday,"If Swiss PunkRock is as good as swiss chocolate, Hateful Monday definitiely is the peanut of it all... Formed in 1999 in the Geneva suburbs by Lead singer Seb and drummer Igor, the band will later find its final identity with the arrival of guitar palyers Gr3g and Matt, coming all the way from the nice french neighbourood... The band already have 2 EP and 1 LP released on independant swiss label such as Hannibal's Records (Swiss favorite independant sh*t !). <a href=""https://www.last.fm/music/Hateful+Monday"">Read more on Last.fm</a>",3756,60571,"('Standing Still', 'Down By Fire', 'New Pokerface', 'High Five Drive', 'Pendleton')"
161,Bikini,"There are more than one artist that share the name 'Bikini'. In the order of the length of their career:

1. Rock band from Hungary.
2. Electronic duo from Canada.
3. New Wave band from Poland.
4. Female vocalist duo from Denmark.
5. Punk-rock duo from Czech Republic.
6. Trip-hop/Dub collaboration from Israel.

1. Formed by Nagy Feró and Németh Alajos in 1982, Budapest, Hungary, Bikini is one of the most successful Hungarian rock band of the eighties. <a href=""https://www.last.fm/music/Bikini"">Read more on Last.fm</a>",36086,444200,"('Republic', 'Quimby', 'Tankcsapda', 'Edda', 'Bëlga')"
162,Megas,"Megas (born April 7, 1945 in Reykjavík, Iceland), is a renowned rock and roll singer, songwriter and writer.

Being an admirer of Elvis Presley, Megas welcomed the arrival of rock & roll to Iceland by 1956, although his interest in music had to be postponed while he attended grammar school in 1960.

While he was young, he studied piano and showed skill at painting. He wrote outrageous short stories for the school papers and in 1968 he also published the sheet music and lyrics to 14 songs, many of which would be released on his first records. <a href=""https://www.last.fm/music/Megas"">Read more on Last.fm</a>",27596,241807,"('Monolism', 'Decisive Koala', 'King Palm', 'Graeda', 'Davz')"
163,Cliff Richard & The Shadows,"Sir Cliff Richard OBE (born Harry Rodger Webb on 14 October 1940) is an English singer.

With his backing group The Shadows, he dominated the British popular music scene in the late 1950s and early 1960s, before and during the The Beatles' first year in the charts. A conversion to Christianity and subsequent softening of his music led to his having more of a pop than rock image. Although never able to achieve the same impact in the United States as in Britain (in spite of several chart hits there) <a href=""https://www.last.fm/music/Cliff+Richard+&+The+Shadows"">Read more on Last.fm</a>",110407,655801,"('Cliff Richard', 'Gerry & The Pacemakers', 'The Searchers', 'Adam Faith', 'The Shadows')"
164,Wraygunn,"A project from Coimbra, Portugal of Paulo Furtado, also the head of the one-man blues band The Legendary Tiger Man.
They were considered one of the most interesting rock bands of the last few years. Their first release was the EP ""Amateur"" in 2000, after which ""Soul Jam"" came in 2001. In 2004, and with a new formation, ""Eclesiastes 1:11"" was released, with well-marked influences of North-American black culture, like Gospel music and Blues along with Rock n' Roll. ""Shangri-la"" was released in 2007, followed by a huge tour around Portugal. <a href=""https://www.last.fm/music/Wraygunn"">Read more on Last.fm</a>",16669,214641,"('The Legendary Tiger Man', 'Bunnyranch', 'The Vicious Five', 'Mundo Cão', 'Balla')"
165,Paul Mark & the Van Dorens,"Paul Mark's latest collection, Smartest Man in the Room (RDTN 5929) on New York City-based Radiation Records, was recorded in 2011-12 in New Orleans LA and in Memphis TN. It's the ninth release by multi-instrumentalist and songwriter Paul Mark. He's also principal owner of Radiation Records Inc. and Last Warning Music, his publishing company, both of which were founded in 1995. Over the past 25+ years his band Paul Mark & the Van Dorens have performed thousands of sets of live music along the North American bar and festival circuit. <a href=""https://www.last.fm/music/Paul+Mark+&+the+Van+Dorens"">Read more on Last.fm</a>",441,3246,"('John Earl Walker', 'Willie King', 'Shawn Pittman', 'John Earl Walker Band', ""Smokin' Joe Kubek & Bnois King"")"
166,The Searchers,"Originally founded as a skiffle group in Liverpool in 1959 by John McNally and Mike Pender (Mike Prendergast), the band took their name from the classic 1956 John Wayne western The Searchers. Prendergast claims that the name was his idea, but McNally ascribes it to 'Big Ron' Woodbridge, their first lead singer. The issue remains unresolved.

The band grew out of an earlier skiffle group formed by McNally, with his friends Brian Dolan (guitar) and Tony West (bass). <a href=""https://www.last.fm/music/The+Searchers"">Read more on Last.fm</a>",362140,2341236,"('The Swinging Blue Jeans', ""Herman's Hermits"", 'Manfred Mann', 'Gerry & The Pacemakers', 'Ricky Nelson')"
167,Árnyak,"Az Árnyak egy 1994-ben Szolnokon alakult magyar dark rock/gothic rock együttes. Szövegeikben visszatérő motívumok a szerelem és a magány. Dalaikban egyedi módon ötvözik a búskomor dallamot az érzéseket analizáló szöveggel.
Első lemezeik szerzői kiadásban jelentek meg, de 2001-ben a Hammer Musichoz tartozó Nail Recordshoz szerződtek, és a 2001-es Nehéz csend című album már az ő gondozásukban jelent meg. Többször felléptek a Gothica fesztiválon <a href=""https://www.last.fm/music/+noredirect/%C3%81rnyak"">Read more on Last.fm</a>",363,10135,"('F.O. System', 'Nevergreen', 'Zorall', 'Christian Epidemic', 'Kalapács')"
168,The Yellow Monkey,"The Yellow Monkey (ザイエローモンキー), often abbreviated to yemon (イエモン), is a popular Japanese rock band formed in 1989. Its name derives from an ethnic slur and is an ironic reference to the belief that Japanese rock groups could never be ""authentic"".

In 2003, HMV Records Japan rated them #81 in their ""Top 100 Japanese pops Artists"".

Although band activities were ceased starting from January 2001, except for later releases of band material such as compilations and DVDs, The Yellow Monkey actually broke up on July 7, 2004. <a href=""https://www.last.fm/music/The+Yellow+Monkey"">Read more on Last.fm</a>",47260,2794062,"('GLAY', ""B'z"", 'ゴスペラーズ', 'LOVE PSYCHEDELICO', 'Triceratops')"
169,Baraflokkurinn," <a href=""https://www.last.fm/music/Baraflokkurinn"">Read more on Last.fm</a>",1257,5677,"('Spilafífl', 'Jonee Jonee', 'Vonbrigði', 'Friðryk', 'Fræbbblarnir')"
170,Rebel Storm," <a href=""https://www.last.fm/music/Rebel+Storm"">Read more on Last.fm</a>",195,1882,"('Swampdawamp', 'Alligator Jackson', 'Ghost Riders', 'The 484 South Band', 'Alligator Stew')"
171,Gualberto Castro," <a href=""https://www.last.fm/music/Gualberto+Castro"">Read more on Last.fm</a>",2972,14101,"('Imelda Miller', 'Manolo Muñoz', 'César Costa', 'Angélica María', 'María Del Sol')"
172,Maus,"There is more than one artist with this name:

1) Maus is an electronic artist who originally published to MP3.com 
2) Maus is an inactive indie rock band, current projects including: bigital, sometime and frae.
3) Punk band from Edmonton, Alberta, Canadia
4) Indie pop band from Groningen, The Netherlands

in the '90s. He is presently based in Venice Beach, CA.
Albums:
    * 1998 - Mausdisc 
    * 1999 - Howitzer Groupings
    * 2000 - Today Smelled Like the Air and Space Museum <a href=""https://www.last.fm/music/Maus"">Read more on Last.fm</a>",11114,116255,"('Botnleðja', 'Ensími', ""Benny Crespo's Gang"", 'Lada Sport', 'Hjálmar')"
173,Ebiet G. Ade,"Ebiet G. Ade (born 21 April 1955) is an Indonesian singer and songwriter close to the suppressed society. His musical touch has influenced Indonesian pop music. His lyrics are made by himself, he never collaborates with other musicians to arrange the lyrics, but he can collaborate with them to arrange his musical arrangement.

Born as Abdul Gafar Abdullah in Wonodadi, Banjarnegara; he is the youngest son of Aboe Ja'far. He had many desires: engineer, doctor, and painter. <a href=""https://www.last.fm/music/Ebiet+G.+Ade"">Read more on Last.fm</a>",12675,287197,"('Broery Marantika', 'Gombloh', 'Koes Plus', 'Panbers', 'Betharia Sonata')"
174,Ramona Silver," <a href=""https://www.last.fm/music/Ramona+Silver"">Read more on Last.fm</a>",287,2719,"('Big Faith', 'Randy Stonehill/Kate Miner', 'Iain', 'Parmin Sisters', 'John Austin')"
175,Rod Stewart,"Sir Roderick David Stewart (born 10 January 1945) is a British rock and pop singer and songwriter. Born and raised in London, he is of Scottish and English ancestry. With his distinctive raspy singing voice, Stewart is among the best-selling music artists of all time, having sold over 250 million records worldwide. He has had 10 number-one albums and 31 top ten singles in the UK, six of which reached number one. Stewart has had 16 top ten singles in the US, with four reaching number one on the Billboard Hot 100. <a href=""https://www.last.fm/music/Rod+Stewart"">Read more on Last.fm</a>",1987152,27702048,"('Faces', 'Elton John', 'John Mellencamp', 'Eagles', 'Phil Collins')"
176,teNPel,"Some might say the brightest flame burn quickest and although ten years is more than a lifetime when it comes to music, truth is that TENPEL still holds the esteemed distinction as being one of those bands revitalizing the pillars of Spanish rock music.

So what, you ask, make TENPEL different? Well, they don’t wear make up, they don’t care about image and they aren’t a here today, gone tomorrow. They definitely rock. Most importantly their music is the proof they still are true to themselves <a href=""https://www.last.fm/music/teNPel"">Read more on Last.fm</a>",3014,237607,"('Skunk D.F.', 'Coilbox', 'Estirpe', 'Aphonnic', 'Wakala')"
177,Tall Tales & True," <a href=""https://www.last.fm/music/+noredirect/Tall+Tales+&+True"">Read more on Last.fm</a>",348,1740,()
178,Andrés Calamaro,"Andres Calamaro is one of the most popular Argentinian pop-rock songwriters. A songs craftsman, as he likes to consider himself.

Born Aug 22, 1961 in Buenos Aires, Argentina, he began his professional musical career at the age of 17 playing keyboards in Raíces.
In 1981 he incorporated to one of the main bands of the Argentinean '80s rock scene: Los Abuelos de la Nada. Although the band was led by the brilliant Miguel Abuelo, Calamaro composed most of the band's hits <a href=""https://www.last.fm/music/+noredirect/Andr%C3%A9s+Calamaro"">Read more on Last.fm</a>",419004,14890522,"('Los Rodríguez', 'Fito Páez', 'Intoxicados', 'Los Abuelos de la Nada', 'Bersuit Vergarabat')"
179,The Land Of Nod,"2001’s ‘Mont Ventoux’ release saw Edwin Pouncey state in The Wire “The group have been compared to Neu! But here they owe more to the hanging mists of Popul Vuh during the latters golden Herzog soundtrack period”, going on to add “Stripped of frills and posturing, their music gently breathes in your ear, urging you to dream”. The ‘Mont Ventoux’ release saw the group experiment with sound collages and loops and the title track was written about one of the highest summit's in cycling's Tour De France. <a href=""https://www.last.fm/music/The+Land+Of+Nod"">Read more on Last.fm</a>",1702,20420,"('Last Vote', 'Bury the Sound', 'priva', 'Pan Galactic Straw-Boss', 'Petrograd In Transit')"
180,Silly,"1) Silly is a German rock band. Founded in East Berlin in 1978, Silly was one of the country's most popular music acts, and was well known for its charismatic lead singer Tamara Danz, who died on 22 July 1996. The German actress and singer Anna Loos took over permanently the role of the lead singer in fall 2006 with remarkable success. Official Website

2) Silly was a pop punk band from Banner Elk, NC. They released a a demo cassette entitled ""Silly Doesn't Do It"" and a CD entitled ""Will You Go With Me?"" in 1995 on Blindside/Ghostmeat Records. <a href=""https://www.last.fm/music/Silly"">Read more on Last.fm</a>",56606,736814,"('City', 'Karat', 'Heinz Rudolf Kunze', 'Puhdys', 'Keimzeit')"
181,Goldenboy,"Goldenboy is one of the following:

1. An indie pop band that toured with Elliott Smith. During that time, Smith took to calling frontman Shon Sullivan by the nickname ""Goldenboy."" The name stuck as Sullivan developed his sound and added members to the Goldenboy lineup. Smith was instrumental in getting the band's first album, ""Blue Swan Orchestra,"" recorded. Goldenboy recently released a follow up record, entitled ""Underneath the Radio,"" including guest spots from Neil Finn, Lisa Germano and Matt Sharp (The Rentals). <a href=""https://www.last.fm/music/Goldenboy"">Read more on Last.fm</a>",14535,106002,"('Matt Sharp', 'The Loves', 'Irving', 'From Bubblegum To Sky', 'Modern Rivals')"
182,Spahn Ranch,"Spahn Ranch is the name of two bands:
1. An industrial group from LA 
2. A post-punk act from Detroit

The first and most well known is the Los Angeles electronic-industrial music group, formed in 1992 by Matt Green and his New York-based collaborator, Rob Morton. The group signed to Cleopatra Records. That same year, a self-titled, four-song EP with vocals supplied by Scott Franklin (later to become bassist for The Cramps), was released. In 1993, they added vocalist Athan Maroulis and recorded their debut album Collateral Damage. <a href=""https://www.last.fm/music/Spahn+Ranch"">Read more on Last.fm</a>",34715,342987,"('Hate Dept.', 'Skinny Puppy', 'Leæther Strip', 'Razed in Black', 'Front Line Assembly')"
183,Meat For Dogs," <a href=""https://www.last.fm/music/Meat+For+Dogs"">Read more on Last.fm</a>",321,4783,"('Crummy Stuff', 'Derozer', 'Gli Impossibili', 'Skruigners', 'Destinazione Finale')"
184,Gabi Novak,"Gabi Novak is a famous Croatian singer. She is the daughter of Djuro Novak and Elizabeth Reiman. Since 1973, she has been married to famous Croatian singer and composer Arsen Dedić with whom she has a son Matija Dedić, who is also actively engaged in the music business.

Gabi Novak, prva dama hrvatske šlageristike, velika muza i supruga Arsena Dedića, rođena u Berlinu. Živi u Zagrebu.

Nakon djetinjstva provedenog u Berlinu i na Hvaru 1946. <a href=""https://www.last.fm/music/Gabi+Novak"">Read more on Last.fm</a>",4903,64546,"('Arsen Dedić', 'Meri Cetinic', 'Tereza Kesovija', 'Beti Jurkovič', 'Ksenija Erker')"
185,Sons of Trout," <a href=""https://www.last.fm/music/Sons+of+Trout"">Read more on Last.fm</a>",200,1184,"('Springbok Nude Girls', 'Andrew Lloyd Webber, David Easter & ""Joseph And The Amazing Technicolour Dreamcoat"" 1991 London Cast', 'Sugardrive', 'Wonderboom', 'Just Jinger')"
186,Philippe Katerine,"Philippe Katerine (known as Katerine for his artistic work) is a French singer and composer, who published eight records since the beginning of his career in 1991.
He was born in 1968. This could be seen as mistagged since his stage name is simply Katerine.

 <a href=""https://www.last.fm/music/+noredirect/Philippe+Katerine"">Read more on Last.fm</a>",41495,416040,()
187,SABOTEN,"1. SABOTEN is a Japanese rock band formed in 1999. Their song シナリオ was used as the fifteenth and final ending theme to the anime ""NARUTO"".

2. Saboten (  サボテン) was a japanese new wave/art-rock band that made their album debut in 1982 with  Satomi Makino (Guitar, Vocals),  Izumi Imazawa (Bass, Keyboards),  Atsuko Sakai (Drums)  and Masae Fuma (Guitar, Vocals). 

*Please, if you are listening to songs by artist (2), use the correct tag for the artist: サボテン. <a href=""https://www.last.fm/music/SABOTEN"">Read more on Last.fm</a>",23816,200455,"('Gagaga SP', 'AMADORI', 'ザ・マスミサイル', '雷鼓', 'alüto')"
